taskId,title,status,priority,type
1,Implement user authentication,todo,high,feature
2,Fix navigation menu alignment,in Progress,medium,bug
3,Update API documentation,done,low,documentation
4,Add search functionality to dashboard,todo,high,feature
5,Resolve memory leak in data grid,done,high,bug
6,Refactor payment processing service,canceled,medium,feature
7,Improve page load performance,in Progress,high,feature
8,Write comprehensive unit tests for auth module,backlog,medium,documentation
9,Design new landing page layout,todo,medium,feature
10,Fix responsive layout issues on mobile devices,done,low,bug
11,Integrate third-party analytics tracking,in Progress,medium,feature
12,Update deprecated API endpoints,canceled,high,feature
13,Add multi-language support to frontend,todo,high,feature
14,Fix session timeout handling bug,in Progress,medium,bug
15,Create user guide for admin panel,backlog,low,documentation
16,Optimize database queries for reports,done,high,feature
17,Implement dark mode toggle,in Progress,medium,feature
18,Fix form validation errors on checkout page,done,high,bug
19,Add export to PDF functionality,backlog,medium,feature
20,Remove deprecated components,canceled,medium,feature
21,Upgrade to latest framework version,todo,high,feature
22,Fix cross-browser compatibility issues,in Progress,low,bug
23,Write technical specification for new module,backlog,medium,documentation
24,Implement real-time notifications,todo,high,feature
25,Resolve security vulnerability in login,done,high,bug
26,Refactor legacy code in user management,canceled,medium,feature
27,Add pagination to long lists,in Progress,low,feature
28,Update error messages for better UX,done,low,documentation
29,Implement file upload progress indicator,todo,medium,feature
30,Fix image loading bug on slow connections,in Progress,medium,bug
31,Create API rate limiting documentation,backlog,low,documentation
32,Add two-factor authentication support,todo,high,feature
33,Fix data synchronization issue between tabs,done,high,bug
34,Improve accessibility compliance,in Progress,medium,feature
35,Write migration guide for new version,backlog,medium,documentation
36,Implement caching layer for API calls,done,high,feature
37,Fix duplicate entry bug in forms,in Progress,low,bug
38,Add support for new payment gateway,todo,high,feature
39,Update dependency versions,canceled,medium,feature
40,Create automated backup system docs,backlog,low,documentation
41,Fix infinite scroll loading issue,in Progress,medium,bug
42,Implement role-based access control,todo,high,feature
43,Refactor state management logic,done,medium,feature
44,Add logging for critical operations,backlog,low,documentation
45,Fix timezone handling in date picker,in Progress,medium,bug
46,Implement webhook support for events,todo,high,feature
47,Update UI components to new design system,canceled,medium,feature
48,Write performance testing report,backlog,low,documentation
49,Fix authentication token refresh bug,done,high,bug
50,Migrate database to new schema,todo,high,feature